14:09:37 [INFO] CONFIG VALIDATION COMPLETED.
14:09:40 [DEBUG] Consider installing rusty-rlp to improve pyrlp performance with a rust basedbackend. Not currently functional for Python 3.11
14:09:40 [INFO] 🛡️ Lighter Rate Limiter Tier: STANDARD
14:09:41 [DEBUG] ✅ Decimal adapter registered for SQLite
14:09:41 [INFO] 🔥 BOT V5 (Architected) STARTING...
14:09:41 [INFO] 🚀 Starting InMemoryStateManager...
14:09:41 [INFO] 📂 Initializing database: data/trades.db
14:09:41 [INFO] ✅ Read pool created: 5 connections
14:09:41 [INFO] ✅ WAL mode enabled
14:09:41 [INFO] 🔄 Running database migrations...
14:09:41 [INFO] ✅ Migrations complete (14 statements)
14:09:41 [INFO] ✅ Database initialized
14:09:41 [INFO] 🖊️ Database write loop started
14:09:41 [DEBUG] Maintenance not due (Last: 20h ago)
14:09:41 [INFO] 📂 Loaded 3 trades from database
14:09:41 [INFO] ✅ InMemoryStateManager started (loaded 3 trades)
14:09:41 [INFO] ✅ State Manager started
14:09:41 [INFO]  Telegram Bot disabled (Token/ChatID missing).
14:09:41 [INFO] ✅ Async database initialized
14:09:41 [INFO] 📝 State writer loop started
14:09:41 [DEBUG] ✅ Database schema up to date
14:09:41 [INFO] Initialisiere X10 Adapter...
14:09:41 [INFO]  X10 Account initialisiert.
14:09:41 [INFO] Initialisiere Lighter Adapter...
14:09:41 [INFO] ✅ Using SaferSignerClient subclass instead of Monkey-Patch
14:09:41 [INFO] 💰 Checking exchange balances at startup...
14:09:41 [DEBUG] Sending GET https://api.starknet.extended.exchange/api/v1/user/balance
14:09:42 [INFO] 💰 X10 verfügbare Balance: $231.98 USDC
14:09:42 [DEBUG] Starting new HTTPS connection (1): mainnet.zklighter.elliot.ai:443
14:09:43 [DEBUG] https://mainnet.zklighter.elliot.ai:443 "GET /api/v1/nextNonce?account_index=60113&api_key_index=3 HTTP/1.1" 200 25
14:09:45 [DEBUG] Lighter Balance: Raw=$264.63, Safe=$251.40
14:09:45 [INFO] 💰 STARTUP BALANCE CHECK: X10=$231.98, Lighter=$251.40
14:09:45 [INFO] ✅ Exchange balances OK - Bot can trade!
14:09:45 [INFO] 💰 FeeManager initialized (Dynamic Fees: ENABLED)
14:09:45 [DEBUG] FeeManager: Adapters set (X10=True, Lighter=True)
14:09:45 [INFO] ✅ Lighter Fee Check OK (Using Config): Maker=0.0007, Taker=0.001
14:09:45 [INFO] ✅ Lighter Fees updated: Maker=0.000700, Taker=0.001000 (source=api)
14:09:46 [INFO] ✅ X10 Fee Schedule (REST /api/v1/user/fees): Maker=0.000000, Taker=0.000225
14:09:46 [INFO] ✅ X10 Fees updated: Maker=0.000000, Taker=0.000225 (source=api)
14:09:46 [INFO] ✅ FeeManager started with periodic refresh
14:09:46 [INFO] ✅ FeeManager started
14:09:46 [INFO] 🎲 KellyPositionSizer initialized (Safety=0.25, MaxFraction=0.1)
14:09:46 [INFO] ✅ Kelly Sizer initialized
14:09:46 [INFO] ✅ Funding Tracker started (updates every 3600s)
14:09:46 [INFO] ✅ FundingTracker started
14:09:46 [INFO] 📊 Loading Market Data via REST...
14:09:46 [INFO] 🔄 Funding tracking loop started...
14:09:46 [INFO] 📊 Updating funding for 3 open trades...
14:09:46 [DEBUG] Sending GET https://api.starknet.extended.exchange/api/v1/user/positions?
14:09:46 [DEBUG] Sending GET https://api.starknet.extended.exchange/api/v1/info/markets?
14:09:47 [INFO] ✅ Lighter: Loaded 114 markets (base data)
14:09:47 [INFO] Lighter: Found 0 open positions
14:09:47 [DEBUG] Sending GET https://api.starknet.extended.exchange/api/v1/user/positions?
14:09:48 [INFO]  X10: 91 Märkte geladen, 91 Funding Rates, 78 Preise
14:09:48 [INFO] ✅ Lighter: Updated 113 markets with size_decimals from API
14:09:48 [INFO] 📊 MARKET ADA-USD: size_decimals=1, price_decimals=5, min_base_amount=10.0
14:09:48 [INFO] 📊 MARKET SEI-USD: size_decimals=1, price_decimals=5, min_base_amount=50.0
14:09:48 [INFO] 📊 MARKET RESOLV-USD: size_decimals=0, price_decimals=6, min_base_amount=40.0
14:09:48 [INFO] 📊 MARKET TIA-USD: size_decimals=1, price_decimals=5, min_base_amount=3.0
14:09:48 [INFO] ✅ Markets loaded: X10=91, Lighter=114
14:09:48 [INFO] 📈 Pre-loading Lighter prices...
14:09:49 [INFO] Lighter: Found 0 open positions
14:09:49 [DEBUG] Sending GET https://api.starknet.extended.exchange/api/v1/user/positions?
14:09:50 [DEBUG] Lighter: Loaded 380 funding rates
14:09:51 [INFO] Lighter: Found 0 open positions
14:09:52 [DEBUG] Lighter: Loaded 115 prices via REST
14:09:52 [INFO] ✅ Lighter prices loaded: 115 symbols
14:09:52 [INFO] 🔥 Warming up execution clients (Network Handshake)...
14:09:52 [DEBUG] Sending GET https://api.starknet.extended.exchange/api/v1/info/markets?
14:09:54 [INFO] ✅ Execution clients warmed up & NETWORK READY
14:09:54 [INFO] 启动 OI Tracker für 65 Symbole...
14:09:54 [INFO] ✅ OpenInterestTracker started (interval=15.0s)
14:09:54 [INFO] 🌐 Starting WebSocket Manager...
14:09:54 [INFO] 📊 OI Tracker: Starting cycle 1 (65 symbols)
14:09:54 [INFO] 🔌 [lighter] WebSocket manager started
14:09:54 [INFO] 🔌 [x10_account] WebSocket manager started
14:09:54 [INFO] 🔌 [x10_trades] WebSocket manager started
14:09:54 [INFO] 🔌 [x10_funding] WebSocket manager started
14:09:54 [INFO] 🔌 [x10_orderbooks] WebSocket manager started
14:09:54 [INFO] 🔌 [lighter] Connecting with kwargs: {'close_timeout': 5.0, 'max_size': 4194304, 'ping_interval': 20.0, 'ping_timeout': 10.0}
14:09:54 [INFO] 🔌 [x10_account] Connecting with kwargs: {'close_timeout': 5.0, 'max_size': 4194304, 'ping_interval': 15.0, 'additional_headers': {'X-Api-Key': '***MASKED***', 'User-Agent': 'X10PythonTradingClient/0.4.5'}}
14:09:54 [INFO] 🔌 [x10_trades] Connecting with kwargs: {'close_timeout': 5.0, 'max_size': 4194304, 'ping_interval': 15.0, 'additional_headers': {'X-Api-Key': '***MASKED***', 'User-Agent': 'X10PythonTradingClient/0.4.5'}}
14:09:54 [INFO] 🔌 [x10_funding] Connecting with kwargs: {'close_timeout': 5.0, 'max_size': 4194304, 'ping_interval': 15.0, 'additional_headers': {'X-Api-Key': '***MASKED***', 'User-Agent': 'X10PythonTradingClient/0.4.5'}}
14:09:54 [INFO] 🔌 [x10_orderbooks] Connecting with kwargs: {'close_timeout': 5.0, 'max_size': 4194304, 'ping_interval': 15.0, 'additional_headers': {'X-Api-Key': '***MASKED***', 'User-Agent': 'X10PythonTradingClient/0.4.5'}}
14:09:54 [INFO] ✅ WebSocketManager started (Lighter + X10 Account/Trades/Funding)
14:09:55 [DEBUG] ✅ ZRO-USD: X10=$63,227, Lighter=$599,792, Total=$663,019
14:09:55 [INFO] ✅ [lighter] Connected to wss://mainnet.zklighter.elliot.ai/stream
14:09:55 [INFO] ✅ [lighter] Keepalive enabled: ping_interval=20.0s, ping_timeout=10.0s
14:09:55 [INFO] [lighter] Resubscribing to 75 channels (paced)...
14:09:55 [INFO] [lighter] Receive loop started (async iterator)
14:09:55 [DEBUG] 💓 [lighter] Heartbeat started (stale_threshold=180.0s)
14:09:55 [DEBUG] [lighter] Subscribed to order_book/34
14:09:55 [DEBUG] [lighter] Subscribed to trade/34
14:09:55 [DEBUG] [lighter] Subscribed to order_book/52
14:09:55 [DEBUG] [lighter] Subscribed to trade/52
14:09:55 [DEBUG] [lighter] Subscribed to order_book/27
14:09:55 [DEBUG] [lighter] Subscribed to trade/27
14:09:55 [DEBUG] [lighter] Resubscribed 10/75 channels
14:09:55 [INFO] ✅ [x10_trades] Connected to wss://api.starknet.extended.exchange/stream.extended.exchange/v1/publicTrades
14:09:55 [INFO] ✅ [x10_trades] Keepalive enabled: ping_interval=15.0s, ping_timeout=None (auto-pong)
14:09:55 [INFO] [x10_trades] Receive loop started (async iterator)
14:09:55 [DEBUG] 💓 [x10_trades] Heartbeat started (stale_threshold=300.0s)
14:09:55 [INFO] ✅ [x10_account] Connected to wss://api.starknet.extended.exchange/stream.extended.exchange/v1/account
14:09:55 [INFO] ✅ [x10_account] Keepalive enabled: ping_interval=15.0s, ping_timeout=None (auto-pong)
14:09:55 [INFO] [x10_account] Receive loop started (async iterator)
14:09:55 [DEBUG] 💓 [x10_account] Heartbeat started (stale_threshold=180.0s)
14:09:55 [INFO] ✅ [x10_orderbooks] Connected to wss://api.starknet.extended.exchange/stream.extended.exchange/v1/orderbooks
14:09:55 [INFO] ✅ [x10_orderbooks] Keepalive enabled: ping_interval=15.0s, ping_timeout=None (auto-pong)
14:09:55 [DEBUG] 💰 [x10_account] BALANCE: equity=$231.976129, available=$231.976129, uPnL=$0.000000
14:09:55 [INFO] [x10_orderbooks] Receive loop started (async iterator)
14:09:55 [DEBUG] 💓 [x10_orderbooks] Heartbeat started (stale_threshold=180.0s)
14:09:55 [INFO] ✅ [x10_funding] Connected to wss://api.starknet.extended.exchange/stream.extended.exchange/v1/funding
14:09:55 [INFO] ✅ [x10_funding] Keepalive enabled: ping_interval=15.0s, ping_timeout=None (auto-pong)
14:09:55 [INFO] [x10_funding] Receive loop started (async iterator)
14:09:55 [DEBUG] 💓 [x10_funding] Heartbeat started (stale_threshold=300.0s)
14:09:55 [DEBUG] [lighter] Subscribed to order_book/76
14:09:55 [DEBUG] [lighter] Subscribed to trade/76
14:09:55 [DEBUG] [lighter] Subscribed to order_book/23
14:09:55 [DEBUG] [lighter] Subscribed to trade/23
14:09:55 [DEBUG] [lighter] Subscribed to order_book/35
14:09:55 [DEBUG] [lighter] Subscribed to trade/35
14:09:55 [DEBUG] [lighter] Resubscribed 20/75 channels
14:09:55 [DEBUG] [lighter] Subscribed to order_book/16
14:09:55 [DEBUG] [lighter] Subscribed to trade/16
14:09:55 [DEBUG] [lighter] Subscribed to order_book/29
14:09:55 [DEBUG] [lighter] Subscribed to trade/29
14:09:55 [DEBUG] [lighter] Subscribed to order_book/83
14:09:55 [DEBUG] [lighter] Subscribed to trade/83
14:09:55 [DEBUG] [lighter] Resubscribed 30/75 channels
14:09:55 [DEBUG] [lighter] Subscribed to order_book/5
14:09:55 [DEBUG] [lighter] Subscribed to trade/5
14:09:55 [DEBUG] [lighter] Subscribed to order_book/20
14:09:55 [DEBUG] [lighter] Subscribed to trade/20
14:09:56 [DEBUG] [lighter] Subscribed to order_book/50
14:09:56 [DEBUG] [lighter] Subscribed to trade/50
14:09:56 [DEBUG] [lighter] Resubscribed 40/75 channels
14:09:56 [DEBUG] [lighter] Subscribed to order_book/53
14:09:56 [DEBUG] [lighter] Subscribed to trade/53
14:09:56 [DEBUG] [lighter] Subscribed to order_book/86
14:09:56 [DEBUG] [lighter] Subscribed to trade/86
14:09:56 [DEBUG] [lighter] Subscribed to order_book/6
14:09:56 [DEBUG] [lighter] Subscribed to trade/6
14:09:56 [DEBUG] [lighter] Subscribed to order_book/21
14:09:56 [DEBUG] [lighter] Subscribed to trade/21
14:09:56 [DEBUG] [lighter] Resubscribed 50/75 channels
14:09:56 [DEBUG] [lighter] Subscribed to order_book/33
14:09:56 [DEBUG] [lighter] Subscribed to trade/33
14:09:56 [DEBUG] [lighter] Subscribed to order_book/9
14:09:56 [DEBUG] [lighter] Subscribed to trade/9
14:09:56 [DEBUG] [lighter] Subscribed to order_book/24
14:09:56 [DEBUG] [lighter] Subscribed to trade/24
14:09:56 [DEBUG] [lighter] Subscribed to order_book/58
14:09:56 [DEBUG] [lighter] Subscribed to trade/58
14:09:56 [DEBUG] [lighter] Resubscribed 60/75 channels
14:09:56 [DEBUG] [lighter] Subscribed to order_book/72
14:09:56 [DEBUG] [lighter] Subscribed to trade/72
14:09:56 [DEBUG] [lighter] Subscribed to order_book/12
14:09:56 [DEBUG] [lighter] Subscribed to trade/12
14:09:56 [DEBUG] [lighter] Subscribed to order_book/45
14:09:56 [DEBUG] [lighter] Subscribed to trade/45
14:09:56 [DEBUG] [lighter] Subscribed to order_book/7
14:09:56 [DEBUG] [lighter] Subscribed to trade/7
14:09:56 [DEBUG] [lighter] Resubscribed 70/75 channels
14:09:56 [INFO] [lighter] Resubscribed to 75 channels
14:09:56 [DEBUG] [lighter] Subscribed to order_book/28
14:09:56 [DEBUG] [lighter] Subscribed to trade/28
14:09:56 [DEBUG] [lighter] Subscribed to order_book/38
14:09:56 [DEBUG] [lighter] Subscribed to trade/38
14:09:56 [DEBUG] [lighter] Subscribed to order_book/46
14:09:56 [DEBUG] [lighter] Subscribed to trade/46
14:09:56 [INFO] [x10] Connected to Firehose streams (Trades & Funding) for all markets.
14:09:56 [INFO] 🔗 Components Wired: WS -> OI Tracker -> Prediction
14:09:56 [INFO] 🧟 Starte Zombie-Check: Vergleiche DB mit echten Positionen...
14:09:56 [INFO] 🔍 DB meldet 3 offene Trades. Prüfe Exchange...
14:09:56 [DEBUG] Sending GET https://api.starknet.extended.exchange/api/v1/user/positions?
14:09:57 [INFO] Lighter: Found 0 open positions
14:09:57 [INFO] 🌍 Echte Positionen auf Exchanges: []
14:09:57 [WARNING] ⚠️  ZOMBIE: CRV-USD - closing in DB...
14:09:57 [INFO] 📝 close_trade_in_state(CRV-USD): PnL=$0.0000, Funding=$0.0000
14:09:57 [INFO] 📝 StateManager.close_trade(CRV-USD): PnL=$0.0000, Funding=$0.0000
14:09:57 [DEBUG] 📝 StateManager.close_trade(CRV-USD): update_trade returned True
14:09:57 [INFO] ✅ Trade CRV-USD closed in state (PnL: $0.0000, Funding: $0.0000)
14:09:57 [WARNING] ⚠️  ZOMBIE: 1000PEPE-USD - closing in DB...
14:09:57 [INFO] 📝 close_trade_in_state(1000PEPE-USD): PnL=$0.0000, Funding=$0.0000
14:09:57 [INFO] 📝 StateManager.close_trade(1000PEPE-USD): PnL=$0.0000, Funding=$0.0000
14:09:57 [DEBUG] 📝 StateManager.close_trade(1000PEPE-USD): update_trade returned True
14:09:57 [INFO] ✅ Trade 1000PEPE-USD closed in state (PnL: $0.0000, Funding: $0.0000)
14:09:57 [WARNING] ⚠️  ZOMBIE: 1000BONK-USD - closing in DB...
14:09:57 [INFO] 📝 close_trade_in_state(1000BONK-USD): PnL=$0.0000, Funding=$0.0000
14:09:57 [INFO] 📝 StateManager.close_trade(1000BONK-USD): PnL=$0.0000, Funding=$0.0000
14:09:57 [DEBUG] 📝 StateManager.close_trade(1000BONK-USD): update_trade returned True
14:09:57 [INFO] ✅ Trade 1000BONK-USD closed in state (PnL: $0.0000, Funding: $0.0000)
14:09:57 [INFO] 🧟 Reverse Ghost Check: Suche Positionen auf Exchange ohne DB Entry...
14:09:57 [DEBUG] Sending GET https://api.starknet.extended.exchange/api/v1/user/positions?
14:09:57 [INFO] 📝 DB close_trade(CRV-USD): PnL=$0.0000, Funding=$0.0000
14:09:57 [DEBUG] 📝 DB close_trade(CRV-USD): Execute returned 0
14:09:57 [DEBUG] 📝 Flushed 1 writes
14:09:57 [DEBUG] 📝 Flushed 1 writes in 16.0ms
14:09:57 [DEBUG] WS OB Update UNI-USD: 0 bids, 1 asks
14:09:57 [DEBUG] WS OB Update OP-USD: 0 bids, 1 asks
14:09:57 [DEBUG] ✅ CRV-USD: X10=$122,313, Lighter=$1,603,332, Total=$1,725,646
14:09:57 [DEBUG] WS OB Update HYPE-USD: 2 bids, 0 asks
14:09:57 [DEBUG] WS OB Update 1000BONK-USD: 0 bids, 2 asks
14:09:57 [DEBUG] WS OB Update HYPE-USD: 0 bids, 1 asks
14:09:57 [DEBUG] WS OB Update LINK-USD: 0 bids, 0 asks
14:09:57 [DEBUG] WS OB Update AERO-USD: 0 bids, 0 asks
14:09:58 [DEBUG] WS OB Update ENA-USD: 1 bids, 0 asks
14:09:58 [INFO] 📝 DB close_trade(1000PEPE-USD): PnL=$0.0000, Funding=$0.0000
14:09:58 [DEBUG] 📝 DB close_trade(1000PEPE-USD): Execute returned 0
14:09:58 [INFO] 📝 DB close_trade(1000BONK-USD): PnL=$0.0000, Funding=$0.0000
14:09:58 [DEBUG] 📝 Flushed 1 writes in 0.0ms
14:09:58 [DEBUG] WS OB Update ADA-USD: 0 bids, 2 asks
14:09:58 [DEBUG] WS OB Update BCH-USD: 1 bids, 0 asks
14:09:58 [DEBUG] [x10_trades] Firehose stream - no subscription needed
14:09:58 [DEBUG] [x10_funding] Firehose stream - no subscription needed
14:09:58 [DEBUG] WS OB Update PENGU-USD: 0 bids, 1 asks
14:09:58 [DEBUG] WS OB Update ZRO-USD: 0 bids, 1 asks
14:09:59 [INFO] Lighter: Found 0 open positions
14:09:59 [INFO] ✅ No orphaned positions found
14:09:59 [INFO] 🛑 STOPPING BOT: Initiating Graceful Shutdown...
14:09:59 [INFO] 🛑 GRACEFUL SHUTDOWN: Closing all positions...
14:09:59 [INFO] 🛑 Shutdown orchestrator start (reason=funding_bot)
14:09:59 [DEBUG] Sending GET https://api.starknet.extended.exchange/api/v1/user/positions?
14:09:59 [DEBUG] 📝 DB close_trade(1000BONK-USD): Execute returned 0
14:09:59 [DEBUG] 📝 Flushed 2 writes
14:09:59 [DEBUG] 📝 Flushed 1 writes in 0.0ms
14:09:59 [DEBUG] WS OB Update ASTER-USD: 0 bids, 1 asks
14:09:59 [DEBUG] WS OB Update BNB-USD: 0 bids, 0 asks
14:09:59 [DEBUG] WS OB Update BNB-USD: 0 bids, 1 asks
14:09:59 [DEBUG] WS OB Update ZEC-USD: 2 bids, 1 asks
14:09:59 [DEBUG] WS OB Update WIF-USD: 1 bids, 1 asks
14:10:00 [INFO] Lighter: Found 0 open positions
14:10:00 [INFO] 📸 Position snapshot: X10=0, Lighter=0
14:10:00 [INFO] ℹ️ No ParallelExecutionManager registered
14:10:00 [DEBUG] Sending GET https://api.starknet.extended.exchange/api/v1/user/positions?
14:10:00 [DEBUG] WS OB Update XRP-USD: 2 bids, 4 asks
14:10:00 [DEBUG] WS OB Update ADA-USD: 0 bids, 1 asks
14:10:00 [DEBUG] ✅ RESOLV-USD: X10=$143,714, Lighter=$48,361,410, Total=$48,505,124
14:10:01 [DEBUG] WS OB Update XRP-USD: 0 bids, 0 asks
14:10:01 [DEBUG] WS OB Update HYPE-USD: 1 bids, 0 asks
14:10:01 [DEBUG] WS OB Update SOL-USD: 0 bids, 3 asks
14:10:01 [DEBUG] WS OB Update LINK-USD: 0 bids, 0 asks
14:10:01 [DEBUG] WS OB Update ZEC-USD: 0 bids, 1 asks
14:10:02 [INFO] Lighter: Found 0 open positions
14:10:02 [INFO] ⚡ Attempting global Lighter cancel...
14:10:02 [DEBUG] WS OB Update BTC-USD: 1 bids, 0 asks
14:10:02 [DEBUG] WS OB Update POPCAT-USD: 3 bids, 0 asks
14:10:02 [DEBUG] WS OB Update XPL-USD: 0 bids, 1 asks
14:10:02 [DEBUG] WS OB Update AVAX-USD: 0 bids, 1 asks
14:10:02 [DEBUG] WS OB Update ZRO-USD: 0 bids, 1 asks
14:10:03 [DEBUG] WS OB Update BTC-USD: 1 bids, 0 asks
14:10:03 [DEBUG] WS OB Update ZEC-USD: 1 bids, 0 asks
14:10:03 [DEBUG] WS OB Update SUI-USD: 0 bids, 0 asks
14:10:03 [DEBUG] WS OB Update SOL-USD: 0 bids, 0 asks
14:10:03 [DEBUG] ✅ PENGU-USD: X10=$93,615, Lighter=$72,007,716, Total=$72,101,331
14:10:04 [DEBUG] WS OB Update ZRO-USD: 1 bids, 0 asks
14:10:04 [DEBUG] WS OB Update XRP-USD: 1 bids, 0 asks
14:10:04 [DEBUG] WS OB Update SOL-USD: 2 bids, 0 asks
14:10:04 [DEBUG] WS OB Update EIGEN-USD: 3 bids, 2 asks
14:10:05 [DEBUG] WS OB Update BTC-USD: 6 bids, 8 asks
14:10:05 [DEBUG] WS OB Update APT-USD: 1 bids, 0 asks
14:10:05 [DEBUG] WS OB Update ENA-USD: 1 bids, 0 asks
14:10:05 [DEBUG] WS OB Update SUI-USD: 0 bids, 0 asks
14:10:05 [DEBUG] WS OB Update ZORA-USD: 1 bids, 0 asks
14:10:05 [DEBUG] 💓 [lighter] Alive (uptime=10s, last_msg=0s ago, msgs=8882)
14:10:05 [INFO] ⚡ Executing ImmediateCancelAll (nonce=6007)...
14:10:05 [DEBUG] Cancel All Orders Tx Info: {"AccountIndex":60113,"ApiKeyIndex":3,"TimeInForce":0,"Time":0,"ExpiredAt":1765459204695,"Nonce":6007,"Sig":"776Tg+cZTXm13zdaoivJjpBhlQrzCEr2ebk96x8agIlNqAX53Q92INlM2e5VQsqX0TG83rXq6hNCwzbK2YobIdaxt5vCG9ThazCAGjRRmiU="}
14:10:05 [DEBUG] 💓 [x10_funding] Alive (uptime=10s, last_msg=2s ago, msgs=91)
14:10:05 [DEBUG] 💓 [x10_trades] Alive (uptime=10s, last_msg=1s ago, msgs=14)
14:10:05 [DEBUG] 💓 [x10_account] Alive (uptime=10s, last_msg=10s ago, msgs=3)
14:10:05 [DEBUG] 💓 [x10_orderbooks] Alive (uptime=10s, last_msg=0s ago, msgs=3298)
14:10:05 [DEBUG] ✅ MON-USD: X10=$109,969, Lighter=$224,117,022, Total=$224,226,991
14:10:06 [DEBUG] WS OB Update PUMP-USD: 1 bids, 1 asks
14:10:06 [DEBUG] WS OB Update FARTCOIN-USD: 0 bids, 1 asks
14:10:06 [DEBUG] WS OB Update BTC-USD: 1 bids, 3 asks
14:10:06 [DEBUG] Cancel All Orders Send Tx Response: code=200 message='{"ratelimit": "didn\'t use volume quota"}' tx_hash='908fca242ac64cf752aeee20f4736e149df3da763adcf4f2fb3400aa1510486b52f91e58ecf7ea8f' predicted_execution_time_ms=1765458595010 additional_properties={}
14:10:06 [INFO] ✅ Lighter: ImmediateCancelAll executed (tx={"AccountIndex":60113,"ApiKeyIndex":3,"TimeInForce":0,"Time":0,"ExpiredAt":1765459204695,"Nonce":6007,"Sig":"776Tg+cZTXm13zdaoivJjpBhlQrzCEr2ebk96x8agIlNqAX53Q92INlM2e5VQsqX0TG83rXq6hNCwzbK2YobIdaxt5vCG9ThazCAGjRRmiU="})
14:10:06 [INFO] 🛑 Cancelling open orders for 140 symbols (LighterGlobal=True)...
14:10:06 [DEBUG] Sending GET https://api.starknet.extended.exchange/api/v1/user/orders?
14:10:06 [DEBUG] Sending GET https://api.starknet.extended.exchange/api/v1/user/orders?
14:10:06 [DEBUG] WS OB Update BTC-USD: 0 bids, 1 asks
14:10:06 [DEBUG] Sending GET https://api.starknet.extended.exchange/api/v1/user/orders?
14:10:06 [DEBUG] Sending GET https://api.starknet.extended.exchange/api/v1/user/orders?
14:10:06 [DEBUG] Sending GET https://api.starknet.extended.exchange/api/v1/user/orders?
14:10:06 [DEBUG] Sending GET https://api.starknet.extended.exchange/api/v1/user/orders?
14:10:06 [DEBUG] WS OB Update EIGEN-USD: 0 bids, 0 asks
14:10:06 [DEBUG] WS OB Update XRP-USD: 1 bids, 0 asks
14:10:07 [DEBUG] Sending GET https://api.starknet.extended.exchange/api/v1/user/orders?
14:10:07 [DEBUG] Sending GET https://api.starknet.extended.exchange/api/v1/user/orders?
14:10:07 [DEBUG] Sending GET https://api.starknet.extended.exchange/api/v1/user/orders?
14:10:07 [DEBUG] Sending GET https://api.starknet.extended.exchange/api/v1/user/orders?
14:10:07 [DEBUG] Sending GET https://api.starknet.extended.exchange/api/v1/user/orders?
14:10:07 [DEBUG] Sending GET https://api.starknet.extended.exchange/api/v1/user/orders?
14:10:07 [DEBUG] Sending GET https://api.starknet.extended.exchange/api/v1/user/orders?
14:10:07 [DEBUG] Sending GET https://api.starknet.extended.exchange/api/v1/user/orders?
14:10:07 [DEBUG] WS OB Update DOT-USD: 0 bids, 1 asks
14:10:07 [DEBUG] WS OB Update BTC-USD: 3 bids, 0 asks
14:10:07 [DEBUG] Sending GET https://api.starknet.extended.exchange/api/v1/user/orders?
14:10:07 [DEBUG] Sending GET https://api.starknet.extended.exchange/api/v1/user/orders?
14:10:07 [DEBUG] WS OB Update PENGU-USD: 0 bids, 1 asks
14:10:07 [DEBUG] WS OB Update CRV-USD: 0 bids, 1 asks
14:10:07 [DEBUG] Sending GET https://api.starknet.extended.exchange/api/v1/user/orders?
14:10:07 [DEBUG] Sending GET https://api.starknet.extended.exchange/api/v1/user/orders?
14:10:07 [DEBUG] Sending GET https://api.starknet.extended.exchange/api/v1/user/orders?
14:10:07 [DEBUG] Sending GET https://api.starknet.extended.exchange/api/v1/user/orders?
14:10:07 [DEBUG] WS OB Update ZORA-USD: 0 bids, 0 asks
14:10:07 [DEBUG] Sending GET https://api.starknet.extended.exchange/api/v1/user/orders?
14:10:07 [DEBUG] Sending GET https://api.starknet.extended.exchange/api/v1/user/orders?
14:10:07 [DEBUG] WS OB Update ZEC-USD: 1 bids, 3 asks
14:10:07 [DEBUG] Sending GET https://api.starknet.extended.exchange/api/v1/user/orders?
14:10:07 [DEBUG] Sending GET https://api.starknet.extended.exchange/api/v1/user/orders?
14:10:07 [DEBUG] WS OB Update XRP-USD: 1 bids, 0 asks
14:10:07 [DEBUG] Sending GET https://api.starknet.extended.exchange/api/v1/user/orders?
14:10:07 [DEBUG] WS OB Update LDO-USD: 1 bids, 2 asks
14:10:07 [DEBUG] Sending GET https://api.starknet.extended.exchange/api/v1/user/orders?
14:10:07 [DEBUG] Sending GET https://api.starknet.extended.exchange/api/v1/user/orders?
14:10:07 [DEBUG] Sending GET https://api.starknet.extended.exchange/api/v1/user/orders?
14:10:08 [DEBUG] Sending GET https://api.starknet.extended.exchange/api/v1/user/orders?
14:10:08 [DEBUG] WS OB Update OP-USD: 1 bids, 0 asks
14:10:08 [DEBUG] Sending GET https://api.starknet.extended.exchange/api/v1/user/orders?
14:10:08 [DEBUG] Sending GET https://api.starknet.extended.exchange/api/v1/user/orders?
14:10:08 [DEBUG] Sending GET https://api.starknet.extended.exchange/api/v1/user/orders?
14:10:08 [DEBUG] Sending GET https://api.starknet.extended.exchange/api/v1/user/orders?
14:10:08 [DEBUG] Sending GET https://api.starknet.extended.exchange/api/v1/user/orders?
14:10:08 [DEBUG] Sending GET https://api.starknet.extended.exchange/api/v1/user/orders?
14:10:08 [DEBUG] WS OB Update XRP-USD: 1 bids, 0 asks
14:10:08 [DEBUG] Sending GET https://api.starknet.extended.exchange/api/v1/user/orders?
14:10:08 [DEBUG] Sending GET https://api.starknet.extended.exchange/api/v1/user/orders?
14:10:08 [DEBUG] WS OB Update AAVE-USD: 0 bids, 1 asks
14:10:08 [DEBUG] Sending GET https://api.starknet.extended.exchange/api/v1/user/orders?
14:10:08 [DEBUG] Sending GET https://api.starknet.extended.exchange/api/v1/user/orders?
14:10:08 [DEBUG] Sending GET https://api.starknet.extended.exchange/api/v1/user/orders?
14:10:08 [DEBUG] Sending GET https://api.starknet.extended.exchange/api/v1/user/orders?
14:10:08 [DEBUG] Sending GET https://api.starknet.extended.exchange/api/v1/user/orders?
14:10:08 [DEBUG] Sending GET https://api.starknet.extended.exchange/api/v1/user/orders?
14:10:08 [DEBUG] Sending GET https://api.starknet.extended.exchange/api/v1/user/orders?
14:10:08 [DEBUG] Sending GET https://api.starknet.extended.exchange/api/v1/user/orders?
14:10:08 [DEBUG] WS OB Update LINK-USD: 0 bids, 1 asks
14:10:08 [DEBUG] Sending GET https://api.starknet.extended.exchange/api/v1/user/orders?
14:10:08 [DEBUG] Sending GET https://api.starknet.extended.exchange/api/v1/user/orders?
14:10:08 [DEBUG] Sending GET https://api.starknet.extended.exchange/api/v1/user/orders?
14:10:08 [DEBUG] WS OB Update WIF-USD: 0 bids, 1 asks
14:10:08 [DEBUG] Sending GET https://api.starknet.extended.exchange/api/v1/user/orders?
14:10:09 [DEBUG] Sending GET https://api.starknet.extended.exchange/api/v1/user/orders?
14:10:09 [DEBUG] Sending GET https://api.starknet.extended.exchange/api/v1/user/orders?
14:10:09 [DEBUG] Sending GET https://api.starknet.extended.exchange/api/v1/user/orders?
14:10:09 [DEBUG] Sending GET https://api.starknet.extended.exchange/api/v1/user/orders?
14:10:09 [DEBUG] Sending GET https://api.starknet.extended.exchange/api/v1/user/orders?
14:10:09 [DEBUG] Sending GET https://api.starknet.extended.exchange/api/v1/user/orders?
14:10:09 [DEBUG] Sending GET https://api.starknet.extended.exchange/api/v1/user/orders?
14:10:09 [DEBUG] Sending GET https://api.starknet.extended.exchange/api/v1/user/orders?
14:10:09 [DEBUG] WS OB Update DOGE-USD: 0 bids, 0 asks
14:10:09 [DEBUG] Sending GET https://api.starknet.extended.exchange/api/v1/user/orders?
14:10:09 [DEBUG] WS OB Update LINK-USD: 0 bids, 0 asks
14:10:09 [DEBUG] WS OB Update LINK-USD: 0 bids, 0 asks
14:10:09 [DEBUG] Sending GET https://api.starknet.extended.exchange/api/v1/user/orders?
14:10:09 [DEBUG] Sending GET https://api.starknet.extended.exchange/api/v1/user/orders?
14:10:09 [DEBUG] Sending GET https://api.starknet.extended.exchange/api/v1/user/orders?
14:10:09 [DEBUG] Sending GET https://api.starknet.extended.exchange/api/v1/user/orders?
14:10:09 [DEBUG] Sending GET https://api.starknet.extended.exchange/api/v1/user/orders?
14:10:09 [DEBUG] ✅ SOL-USD: X10=$5,099,192, Lighter=$401,793, Total=$5,500,985
14:10:09 [DEBUG] Sending GET https://api.starknet.extended.exchange/api/v1/user/orders?
14:10:09 [DEBUG] Sending GET https://api.starknet.extended.exchange/api/v1/user/orders?
14:10:09 [DEBUG] Sending GET https://api.starknet.extended.exchange/api/v1/user/orders?
14:10:09 [DEBUG] Sending GET https://api.starknet.extended.exchange/api/v1/user/orders?
14:10:09 [DEBUG] Sending GET https://api.starknet.extended.exchange/api/v1/user/orders?
14:10:09 [DEBUG] WS OB Update AERO-USD: 0 bids, 0 asks
14:10:09 [DEBUG] Sending GET https://api.starknet.extended.exchange/api/v1/user/orders?
14:10:09 [DEBUG] WS OB Update ENA-USD: 0 bids, 0 asks
14:10:09 [DEBUG] WS OB Update PENGU-USD: 1 bids, 0 asks
14:10:09 [DEBUG] Sending GET https://api.starknet.extended.exchange/api/v1/user/orders?
14:10:10 [DEBUG] Sending GET https://api.starknet.extended.exchange/api/v1/user/orders?
14:10:10 [DEBUG] Sending GET https://api.starknet.extended.exchange/api/v1/user/orders?
14:10:10 [DEBUG] Sending GET https://api.starknet.extended.exchange/api/v1/user/orders?
14:10:10 [DEBUG] Sending GET https://api.starknet.extended.exchange/api/v1/user/orders?
14:10:10 [DEBUG] WS OB Update SEI-USD: 1 bids, 0 asks
14:10:10 [DEBUG] Sending GET https://api.starknet.extended.exchange/api/v1/user/orders?
14:10:10 [DEBUG] Sending GET https://api.starknet.extended.exchange/api/v1/user/orders?
14:10:10 [DEBUG] Sending GET https://api.starknet.extended.exchange/api/v1/user/orders?
14:10:10 [DEBUG] Sending GET https://api.starknet.extended.exchange/api/v1/user/orders?
14:10:10 [DEBUG] WS OB Update SUI-USD: 1 bids, 0 asks
14:10:10 [DEBUG] Sending GET https://api.starknet.extended.exchange/api/v1/user/orders?
14:10:10 [DEBUG] WS OB Update AAVE-USD: 2 bids, 0 asks
14:10:10 [DEBUG] Sending GET https://api.starknet.extended.exchange/api/v1/user/orders?
14:10:10 [DEBUG] WS OB Update FIL-USD: 1 bids, 0 asks
14:10:10 [DEBUG] Sending GET https://api.starknet.extended.exchange/api/v1/user/orders?
14:10:10 [DEBUG] Sending GET https://api.starknet.extended.exchange/api/v1/user/orders?
14:10:10 [DEBUG] WS OB Update ZEC-USD: 0 bids, 1 asks
14:10:10 [DEBUG] WS OB Update ASTER-USD: 1 bids, 0 asks
14:10:10 [DEBUG] Sending GET https://api.starknet.extended.exchange/api/v1/user/orders?
14:10:10 [DEBUG] Sending GET https://api.starknet.extended.exchange/api/v1/user/orders?
14:10:10 [DEBUG] Sending GET https://api.starknet.extended.exchange/api/v1/user/orders?
14:10:10 [DEBUG] Sending GET https://api.starknet.extended.exchange/api/v1/user/orders?
14:10:10 [DEBUG] Sending GET https://api.starknet.extended.exchange/api/v1/user/orders?
14:10:10 [DEBUG] Sending GET https://api.starknet.extended.exchange/api/v1/user/orders?
14:10:10 [DEBUG] WS OB Update DOGE-USD: 0 bids, 0 asks
14:10:10 [DEBUG] Sending GET https://api.starknet.extended.exchange/api/v1/user/orders?
14:10:10 [DEBUG] Sending GET https://api.starknet.extended.exchange/api/v1/user/orders?
14:10:10 [DEBUG] Sending GET https://api.starknet.extended.exchange/api/v1/user/orders?
14:10:10 [DEBUG] WS OB Update AVAX-USD: 0 bids, 0 asks
14:10:10 [DEBUG] WS OB Update DOGE-USD: 2 bids, 0 asks
14:10:11 [DEBUG] Sending GET https://api.starknet.extended.exchange/api/v1/user/orders?
14:10:11 [DEBUG] Sending GET https://api.starknet.extended.exchange/api/v1/user/orders?
14:10:11 [DEBUG] Sending GET https://api.starknet.extended.exchange/api/v1/user/orders?
14:10:11 [DEBUG] Sending GET https://api.starknet.extended.exchange/api/v1/user/orders?
14:10:11 [DEBUG] Sending GET https://api.starknet.extended.exchange/api/v1/user/orders?
14:10:11 [DEBUG] Sending GET https://api.starknet.extended.exchange/api/v1/user/orders?
14:10:11 [DEBUG] Sending GET https://api.starknet.extended.exchange/api/v1/user/orders?
14:10:11 [DEBUG] Sending GET https://api.starknet.extended.exchange/api/v1/user/orders?
14:10:11 [DEBUG] Sending GET https://api.starknet.extended.exchange/api/v1/user/orders?
14:10:11 [DEBUG] ✅ SPX-USD: X10=$88,731, Lighter=$3,684,207, Total=$3,772,939
14:10:11 [DEBUG] Sending GET https://api.starknet.extended.exchange/api/v1/user/orders?
14:10:11 [DEBUG] Sending GET https://api.starknet.extended.exchange/api/v1/user/orders?
14:10:11 [DEBUG] Sending GET https://api.starknet.extended.exchange/api/v1/user/orders?
14:10:11 [DEBUG] Sending GET https://api.starknet.extended.exchange/api/v1/user/orders?
14:10:11 [DEBUG] Sending GET https://api.starknet.extended.exchange/api/v1/user/orders?
14:10:11 [DEBUG] Sending GET https://api.starknet.extended.exchange/api/v1/user/orders?
14:10:11 [DEBUG] WS OB Update DOGE-USD: 0 bids, 1 asks
14:10:11 [DEBUG] Sending GET https://api.starknet.extended.exchange/api/v1/user/orders?
14:10:11 [DEBUG] WS OB Update VIRTUAL-USD: 0 bids, 1 asks
14:10:11 [DEBUG] WS OB Update XRP-USD: 1 bids, 1 asks
14:10:11 [DEBUG] WS OB Update BERA-USD: 0 bids, 0 asks
14:10:11 [DEBUG] Sending GET https://api.starknet.extended.exchange/api/v1/user/orders?
14:10:11 [DEBUG] Sending GET https://api.starknet.extended.exchange/api/v1/user/orders?
14:10:11 [DEBUG] Sending GET https://api.starknet.extended.exchange/api/v1/user/orders?
14:10:11 [DEBUG] Sending GET https://api.starknet.extended.exchange/api/v1/user/orders?
14:10:11 [DEBUG] Sending GET https://api.starknet.extended.exchange/api/v1/user/orders?
14:10:11 [DEBUG] WS OB Update TON-USD: 0 bids, 2 asks
14:10:11 [DEBUG] Sending GET https://api.starknet.extended.exchange/api/v1/user/orders?
14:10:12 [DEBUG] Sending GET https://api.starknet.extended.exchange/api/v1/user/orders?
14:10:12 [DEBUG] Sending GET https://api.starknet.extended.exchange/api/v1/user/orders?
14:10:12 [DEBUG] WS OB Update ASTER-USD: 1 bids, 0 asks
14:10:12 [DEBUG] Sending GET https://api.starknet.extended.exchange/api/v1/user/orders?
14:10:12 [DEBUG] Sending GET https://api.starknet.extended.exchange/api/v1/user/orders?
14:10:12 [DEBUG] Sending GET https://api.starknet.extended.exchange/api/v1/user/orders?
14:10:12 [DEBUG] Sending GET https://api.starknet.extended.exchange/api/v1/user/orders?
14:10:12 [DEBUG] Sending GET https://api.starknet.extended.exchange/api/v1/user/orders?
14:10:12 [DEBUG] Sending GET https://api.starknet.extended.exchange/api/v1/user/orders?
14:10:12 [DEBUG] WS OB Update TON-USD: 0 bids, 2 asks
14:10:12 [DEBUG] Sending GET https://api.starknet.extended.exchange/api/v1/user/orders?
14:10:12 [DEBUG] Sending GET https://api.starknet.extended.exchange/api/v1/user/orders?
14:10:12 [DEBUG] Sending GET https://api.starknet.extended.exchange/api/v1/user/orders?
14:10:12 [DEBUG] Sending GET https://api.starknet.extended.exchange/api/v1/user/orders?
14:10:12 [DEBUG] Sending GET https://api.starknet.extended.exchange/api/v1/user/orders?
14:10:12 [DEBUG] WS OB Update ADA-USD: 1 bids, 0 asks
14:10:12 [DEBUG] Sending GET https://api.starknet.extended.exchange/api/v1/user/orders?
14:10:12 [DEBUG] WS OB Update PENGU-USD: 1 bids, 0 asks
14:10:12 [DEBUG] Sending GET https://api.starknet.extended.exchange/api/v1/user/orders?
14:10:12 [DEBUG] Sending GET https://api.starknet.extended.exchange/api/v1/user/orders?
14:10:12 [DEBUG] Sending GET https://api.starknet.extended.exchange/api/v1/user/orders?
14:10:12 [DEBUG] Sending GET https://api.starknet.extended.exchange/api/v1/user/orders?
14:10:12 [DEBUG] Sending GET https://api.starknet.extended.exchange/api/v1/user/orders?
14:10:12 [DEBUG] Sending GET https://api.starknet.extended.exchange/api/v1/user/orders?
14:10:13 [DEBUG] Sending GET https://api.starknet.extended.exchange/api/v1/user/orders?
14:10:13 [DEBUG] Sending GET https://api.starknet.extended.exchange/api/v1/user/orders?
14:10:13 [DEBUG] WS OB Update FIL-USD: 0 bids, 0 asks
14:10:13 [DEBUG] Sending GET https://api.starknet.extended.exchange/api/v1/user/orders?
14:10:13 [DEBUG] ✅ JUP-USD: X10=$115,843, Lighter=$4,239,273, Total=$4,355,115
14:10:13 [DEBUG] Sending GET https://api.starknet.extended.exchange/api/v1/user/orders?
14:10:13 [DEBUG] WS OB Update ARB-USD: 1 bids, 0 asks
14:10:13 [DEBUG] WS OB Update SUI-USD: 0 bids, 0 asks
14:10:13 [DEBUG] Sending GET https://api.starknet.extended.exchange/api/v1/user/orders?
14:10:13 [DEBUG] Sending GET https://api.starknet.extended.exchange/api/v1/user/orders?
14:10:13 [DEBUG] Sending GET https://api.starknet.extended.exchange/api/v1/user/orders?
14:10:13 [DEBUG] Sending GET https://api.starknet.extended.exchange/api/v1/user/positions?
14:10:13 [DEBUG] WS OB Update BTC-USD: 3 bids, 1 asks
14:10:13 [DEBUG] WS OB Update ONDO-USD: 0 bids, 0 asks
14:10:14 [DEBUG] WS OB Update ONDO-USD: 0 bids, 0 asks
14:10:14 [DEBUG] WS OB Update ZORA-USD: 4 bids, 0 asks
14:10:14 [DEBUG] WS OB Update SPX-USD: 1 bids, 0 asks
14:10:14 [INFO] Lighter: Found 0 open positions
14:10:14 [INFO] ✅ No open positions to close
14:10:14 [INFO] 🔍 Final position sweep...
14:10:14 [DEBUG] Sending GET https://api.starknet.extended.exchange/api/v1/user/positions?
14:10:15 [DEBUG] WS OB Update FARTCOIN-USD: 8 bids, 6 asks
14:10:15 [DEBUG] WS OB Update CRV-USD: 0 bids, 1 asks
14:10:15 [DEBUG] WS OB Update WIF-USD: 3 bids, 1 asks
14:10:15 [INFO] Lighter: Found 0 open positions
14:10:15 [INFO] ✅ Final sweep: No positions found
14:10:15 [INFO] 🛑 Stopping InMemoryStateManager...
14:10:15 [INFO] 📝 State writer loop stopped
14:10:15 [INFO] ✅ InMemoryStateManager stopped
14:10:15 [INFO] 🛑 FeeManager stopped
14:10:15 [INFO] 🔒 Closing database...
14:10:15 [INFO] 🖊️ Database write loop stopped
14:10:15 [DEBUG] WS OB Update MNT-USD: 1 bids, 0 asks
14:10:15 [INFO] ✅ Database closed
14:10:15 [INFO] 💾 Persist phase complete
14:10:15 [INFO] ✅ Lighter Adapter closed
14:10:15 [INFO] ✅ X10 Adapter geschlossen.
14:10:15 [INFO] ✅ Teardown complete
14:10:15 [DEBUG] Starting new HTTPS connection (1): mainnet.zklighter.elliot.ai:443
14:10:16 [DEBUG] https://mainnet.zklighter.elliot.ai:443 "GET /api/v1/nextNonce?account_index=60113&api_key_index=3 HTTP/1.1" 200 25
14:10:16 [DEBUG] Sending GET https://api.starknet.extended.exchange/api/v1/user/positions?
14:10:16 [DEBUG] 💓 [lighter] Alive (uptime=21s, last_msg=0s ago, msgs=19864)
14:10:16 [DEBUG] 💓 [x10_orderbooks] Alive (uptime=21s, last_msg=0s ago, msgs=5262)
14:10:16 [DEBUG] 💓 [x10_funding] Alive (uptime=21s, last_msg=12s ago, msgs=91)
14:10:16 [DEBUG] 💓 [x10_trades] Alive (uptime=21s, last_msg=2s ago, msgs=33)
14:10:16 [DEBUG] 💓 [x10_account] Alive (uptime=21s, last_msg=21s ago, msgs=3)
14:10:16 [DEBUG] WS OB Update AERO-USD: 0 bids, 0 asks
14:10:16 [DEBUG] WS OB Update MNT-USD: 1 bids, 0 asks
14:10:16 [DEBUG] WS OB Update HYPE-USD: 1 bids, 0 asks
14:10:16 [DEBUG] WS OB Update XPL-USD: 1 bids, 0 asks
14:10:16 [DEBUG] WS OB Update FIL-USD: 1 bids, 0 asks
14:10:16 [DEBUG] WS OB Update PENGU-USD: 0 bids, 2 asks
14:10:16 [DEBUG] WS OB Update BNB-USD: 1 bids, 2 asks
14:10:16 [DEBUG] WS OB Update HYPE-USD: 1 bids, 0 asks
14:10:16 [DEBUG] WS OB Update ZRO-USD: 0 bids, 0 asks
14:10:16 [DEBUG] WS OB Update XRP-USD: 0 bids, 0 asks
14:10:17 [DEBUG] WS OB Update TON-USD: 1 bids, 0 asks
14:10:17 [DEBUG] ✅ FIL-USD: X10=$0, Lighter=$298,678, Total=$298,678
14:10:17 [DEBUG] WS OB Update XRP-USD: 0 bids, 1 asks
14:10:17 [DEBUG] WS OB Update MON-USD: 1 bids, 0 asks
14:10:17 [DEBUG] WS OB Update BTC-USD: 1 bids, 0 asks
14:10:18 [INFO] Lighter: Found 0 open positions
14:10:18 [INFO] ✅ All positions closed. Bye! (elapsed=16.28s)
14:10:18 [INFO] ✅ All positions closed. Bye!
14:10:18 [INFO] 🛑 Stopping Infrastructure...
14:10:18 [INFO] 🛑 Stopping InMemoryStateManager...
14:10:18 [INFO] ✅ InMemoryStateManager stopped
14:10:18 [INFO] 🛑 FeeManager stopped
14:10:18 [INFO] ✅ X10 Adapter geschlossen.
14:10:18 [INFO] ✅ Lighter Adapter closed
14:10:18 [INFO] 🛑 Funding tracker: Cancelled
